@,image,title,value,suit1,suit2,suit3,suit1b,suit2b,suit3b,suit1[style:fill],suit2[style:fill],suit3[style:fill],suit1b[style:fill],suit2b[style:fill],suit3b[style:fill],descriptionborder,E:\decktet\img\the author.png,the AUTHOR,2,A,F,,a,f,,#000000,#000000,#000000,#c8c7c8,#ebf04b,,"The Author is an artisan, like the Painter and the Bard. The important difference between them is their relation to the facts that they present. As a Moon card, the Author faces mysteries. So the Author is a character of investigation, enquiry, and at most partial answers. "border,E:\decktet\img\the origin.png,|^the ORIGIN,2,C,D,,c,d,,#000000,#000000,#000000,#8cb8e6,#b6804e,,"Morning light shines through clear water. The Origin can appear as either a location or an event. As an event, it is morning light. As a location, it is a living spring. "border,E:\decktet\img\the desert.png,|the DESERT,2,B,E,,b,e,,#000000,#000000,#000000,#f68312,#51bf49,,"Barren and without life, the Desert offers a certain grim clarity. Yet clarity might itself be a mirage. "border,E:\decktet\img\the savage.png,the SAVAGE,3,D,E,,d,e,,#000000,#000000,#000000,#b6804e,#51bf49,,"Even if the Savage presents a pleasant face, the wild lurks in his heart. "border,E:\decktet\img\the painter.png,the PAINTER,3,B,F,,b,f,,#000000,#000000,#000000,#f68312,#ebf04b,,The Painter is a figure of revelation. The Painter sees through posturing and portrays things as they need to be portrayed. border,E:\decktet\img\the journey.png,^the JOURNEY,3,A,C,,a,c,,#000000,#000000,#000000,#c8c7c8,#8cb8e6,,"The Journey is in between. It is its own story, written between departure and arrival. "border,E:\decktet\img\the battle.png,^the BATTLE,4,E,F,,e,f,,#000000,#000000,#000000,#51bf49,#ebf04b,,Struggle with forces that are half in shadow. It is not always obvious what those forces are until they have done their worst. border,E:\decktet\img\the mountain.png,|the MOUNTAIN,4,A,B,,a,b,,#000000,#000000,#000000,#c8c7c8,#f68312,,"A quest leads to the peak. Especially if the Mountain appears in a spread with the Journey, to the peak may be more important than at the peak. "border,E:\decktet\img\the sailor.png,the SAILOR,4,C,D,,c,d,,#000000,#000000,#000000,#8cb8e6,#b6804e,,"On the wall of the sailor's house: He is not at home at home. The Sailor is a traveller by nature, uneasy when not underway. "border,E:\decktet\img\the discovery.png,^the DISCOVERY,5,B,C,,b,c,,#000000,#000000,#000000,#f68312,#8cb8e6,,Something buried or lost is found. The Discovery may be the end of a quest or as surprising as a sudden storm. border,E:\decktet\img\the soldier.png,the SOLDIER,5,E,F,,e,f,,#000000,#000000,#000000,#51bf49,#ebf04b,,"Like words to the Author or money to the Merchant, war is craft to the Soldier. Although the conflict might not be a literal war, the Soldier lives for it. The soldier's craft is wrought in stillness and motion. Of all the personalities, the Soldier shows the least difference between its two faces. "border,E:\decktet\img\the forest.png,|the FOREST,5,A,D,,a,d,,#000000,#000000,#000000,#c8c7c8,#b6804e,,"The Forest is usually a literal card representing a forest or wooded place. In a crowded city, however, sometimes even a single tree can be a forest. "border,E:\decktet\img\the market.png,|^the MARKET,6,D,F,,d,f,,#000000,#000000,#000000,#b6804e,#ebf04b,,"The Market can appear as either a location or an event. As a location, the Market is a place of trade. As an event, the Market is commerce. Unlike the Pact, it does not suggest a great confluence; an exchange, and the matter is resolved. "border,E:\decktet\img\the penitent.png,the PENITENT,6,B,E,,b,e,,#000000,#000000,#000000,#f68312,#51bf49,,A higher calling hides a darker past. Redemption is never entirely complete for the Penitent. border,E:\decktet\img\the lunatic.png,the LUNATIC,6,A,C,,a,c,,#000000,#000000,#000000,#c8c7c8,#8cb8e6,,"The Lunatic sees things that no one else sees. Perhaps these are deeper truths, perhaps they are delusions. Watch the great tumult around her. "border,E:\decktet\img\the chance meeting.png,^the CHANCE MEETING,7,A,D,,a,d,,#000000,#000000,#000000,#c8c7c8,#b6804e,,Two stories half-written find themselves writing one another. The Chance Meeting is a card of possibilities. border,E:\decktet\img\the castle.png,|the CASTLE,7,B,F,,b,f,,#000000,#000000,#000000,#f68312,#ebf04b,,"The Castle is a community. It is a place of civility or power, but only rarely of both. "border,E:\decktet\img\the cave.png,|the CAVE,7,C,E,,c,e,,#000000,#000000,#000000,#8cb8e6,#51bf49,,"It is home to grim things and a place of challenges. Things that fall below the surface may be found in the Cave, even if they were long thought lost or destroyed. To enter and return from it once should be enough. "border,E:\decktet\img\the betrayal.png,^the BETRAYAL,8,E,F,,e,f,,#000000,#000000,#000000,#51bf49,#ebf04b,,Even a soft hand can wield a sharp knife. This is a time to be wary. border,E:\decktet\img\the diplomat.png,the DIPLOMAT,8,A,B,,a,b,,#000000,#000000,#000000,#c8c7c8,#f68312,,"The Diplomat mediates between opposites: darkness and light, patience and action, the one and the many. "border,E:\decktet\img\the mill.png,|the MILL,8,C,D,,c,d,,#000000,#000000,#000000,#8cb8e6,#b6804e,,The Mill is a place of craft and production. The tuneless song of the miller is lost in the roar of the water and the ceaseless turning of the wheel. border,E:\decktet\img\the pact.png,^the PACT,9,A,B,,a,b,,#000000,#000000,#000000,#c8c7c8,#f68312,,"When the two kings agree, the stones themselves agree. Even a Pact between just two parties has ramifications for the community and the broader world. "border,E:\decktet\img\the merchant.png,the MERCHANT,9,D,F,,d,f,,#000000,#000000,#000000,#b6804e,#ebf04b,,"For the Merchant, wealth is its own end. The Merchant amasses riches, but worries all the while about losing them. "nborder,,|the DARKNESS,9,C,E,,c,e,,#000000,#000000,#000000,#8cb8e6,#51bf49,,"The Darkness can settle on familiar places and hides all manner of things. Although one may hide there or seek for what is lost there, it is best not to tarry there too long. Unlike the Cave, it is sometimes best to illuminate and dispel the Darkness rather than to flee from it. "border,E:\decktet\img\the bard.png,the BARD,*,B,,,b,,,#000000,#000000,#000000,#f68312,,,"The Bard speaks and people listen. Whereas the Painter can paint the world as it is, things become the way the Bard says they ought to be. "border,E:\decktet\img\the huntress.png,the HUNTRESS,*,A,,,a,,,#000000,#000000,#000000,#c8c7c8,,,"The Huntress finds her mark, like an arrow loosed from a bow. She is a seeker, even if she is unsure what she is seeking, and she is on a quest even in her idle moments. The Huntress stands in the natural world, like a tree in the forest. In some ways, she acts just like an animal; she moves without reflection, in accord with her nature. "border,E:\decktet\img\the sea.png,|the SEA,*,C,,,c,,,#000000,#000000,#000000,#8cb8e6,,,"The Sea is often literally some large body of water. As a symbol, it is the source of storms. "border,E:\decktet\img\the end.png,|^the END,*,D,,,d,,,#000000,#000000,#000000,#b6804e,,,"The End can appear as either a location or an event. As an event, the End is the conclusion of the cycle before the beginnings of the next moment are even buds on the branches. As a location, the End is a terminus at the border of known lands with nothing on the other side. "border,E:\decktet\img\the calamity.png,^the CALAMITY,*,E,,,e,,,#000000,#000000,#000000,#51bf49,,,"Death so sudden that there is no time to bury the dead. Although it can be mitigated by other cards in the spread, the Calamity is always a bad thing. "border,E:\decktet\img\the windfall.png,^the WINDFALL,*,F,,,f,,,#000000,#000000,#000000,#ebf04b,,,"One might have quested for it, if one had known, but it comes unannounced. The Windfall on its own is always a positive card. If there is any cost or caveat, it must come from somewhere else. "border,E:\decktet\img\the watchman.png,the WATCHMAN,#,A,E,F,a,e,f,#000000,#000000,#000000,#c8c7c8,#51bf49,#ebf04b,"Waits for danger to arise and responds, but he may be too late if the he is not perceptive or lucky enough. "border,E:\decktet\img\the borderland.png,|the BORDERLAND,#,C,D,E,c,d,e,#000000,#000000,#000000,#8cb8e6,#b6804e,#51bf49,"The edge of things. A place of chance and uncertainty, harbouring threats and resources in equal measure. "border,E:\decktet\img\the harvest.png,^the HARVEST,#,A,B,D,a,b,d,#000000,#000000,#000000,#c8c7c8,#f68312,#b6804e,"Things come together. What was reaped may be sown. Patience is rewarded. Unlike the Windfall, the Harvest requires preparation and demands labour. "border,E:\decktet\img\the light keeper.png,the LIGHT KEEPER,#,B,C,F,b,c,f,#000000,#000000,#000000,#f68312,#8cb8e6,#ebf04b,"Averts danger. Unlike the reactive Watchman, the Light Keeper prepares for the worst in an attempt to create conditions under which danger is overcome even before it arises. "border,E:\decktet\img\the excuse.png,the EXCUSE,,,,,,,,,,,,,,"Beginners are advised to leave the Excuse out of the deck when telling fortunes. Although some practitioners include it and assign it a special role, there is disagreement about what that role ought to be. Some interpret it as an event. Others interpret it not as being about an excuse, but rather as the deck excusing itself: The matter is too unsettled to say anything helpful, or the question is posed in such an awkward way that saying anything would be misleading. "